ISIN,TypeName,SecurityMarketName,QuantityType,TradingCurrency,MIC,CoursPrice,ClosingPriceDateTime,ClosingPriceType,NominalCumulJour,PreviousClosingPrice,PreviousClosingPriceDateTime,DayMinPrice,DayMaxPrice,MonthMinPrice,MonthMaxPrice,YearMinPrice,YearMaxPrice,Name,Exchange,Type,Market,currency,3Y_Beta,Risk_rating,NAV,date_update,3M_st_dev_perc,1M_st_dev_perc,Sharpe_Ratio,1d_ret_perc,YTD_return,50d_avg,52w_High,52w_Low,Bond_pos,Convertible_pos,Cash,Summary
LU0109395698,Fund,Franklin Templeton Investment Funds Templeton Global Fund I Capitalisation,UNT,USD,EMTF,24.160,2022-12-02 07:47:00,Indicative price,0.0,24.140,2022-12-01 07:47:00,24.160,24.160,24.140,24.160,19.860,28.830,Templeton Global Fund I(acc)USD,EBS,MUTUALFUND,ch_market,USD,,,23.780000686645508,2022-12-05,1.7452515120747902,1.6451999800281496,6.877132718159362,-1.5728442184046787,,,,,,,,
LU0145217120,Fund,Landolt Investment (Lux) SICAV Gold USD Capitalisation,UNT,USD,EMTF,47.570,2022-12-02 12:21:00,Indicative price,0.0,45.620,2022-12-01 11:13:00,47.570,47.570,45.620,47.570,34.530,63.440,Landolt Investment (LUX) SICAV ,PNK,MUTUALFUND,us_market,USD,,,46.279998779296875,2022-12-05,2.69031067321457,2.6809390929979786,5.9601238795742715,-2.4451936783130956,,,,,,,,
LU0097223357,Fund,DBV-Win Fund Dow Jones Industrial Average T Capitalisation,UNT,USD,XLUX,358.050,2022-12-02 07:30:00,Indicative price,0.0,350.150,2022-11-30 17:06:00,358.050,358.050,358.050,358.050,297.050,379.950,DBV-Win Fund Dow Jones Industri,PNK,MUTUALFUND,us_market,USD,,,351.45001220703125,2022-12-05,1.508464213074818,1.2726371761016702,8.750640944112117,-1.4110184650689361,,,,,,,,
LU0062441737,Fund,Argus Funds Global F Capitalisation,UNT,EUR,EMTF,"3,466.500",2022-12-02 14:19:00,Indicative price,0.0,"3,355.500",2022-11-30 15:47:00,"3,466.500","3,466.500","3,466.500","3,466.500","3,109.000","3,614.000",Argus Global F,FRA,MUTUALFUND,dr_market,EUR,,0.0,3466.3798828125,2022-11-30,1.9951804490295377,1.4836359837099276,-4.72956382830158,3.3075038355705466,0.1247,3365.5469,3638.53,3109.0,0.0,0.0,0.0746,
LU0114721508,Fund,Fidelity Funds Sustainable Consumer Brands Fund A EUR Distribution,UNT,EUR,EMTF,75.470,2022-12-02 07:42:00,Indicative price,0.0,74.640,2022-12-01 07:43:00,75.470,75.470,74.640,75.470,66.560,92.740,Fidelity Funds - Sustainable Co,FRA,MUTUALFUND,dr_market,EUR,0.95,2.0,74.61000061035156,2022-12-05,1.146483526379187,1.0923597913004583,3.599980933529921,-0.9557961014230343,0.1266,72.077,84.1,66.56,0.0045,0.0001,0.029000001,
LU0119108826,Fund,Amundi Funds Montpensier Global Convertible Bond A EUR Capitalisation,UNT,EUR,EMTF,13.100,2022-12-02 11:32:00,Indicative price,0.0,13.040,2022-12-01 11:33:00,13.100,13.100,13.040,13.100,12.450,15.530,Amundi Funds - Global Convertib,FRA,MUTUALFUND,dr_market,EUR,0.77,4.0,13.029999732971191,2022-12-05,0.4737824678356945,0.4891863810669543,6.263965947827585,-0.45836836453234664,0.0175,12.7204,1364.0,12.45,0.0022,0.496,0.097600006,"The fund&#39;s objective is to achieve medium- to long-term capital growth. Specifically, the Sub-Fund seeks to outperform (after applicable fees) the Thomson Reuters Convertible Index-Global Focus Hedged (EUR) index. The Sub-Fund invests mainly in convertible bonds of companies around the world. The Sub-Fund seeks to eliminate the effects of most currency exchange differences for investments in non-euro denominated securities (currency hedging). Specifically, the Sub-Fund invests at least 67% of assets in convertible bonds. There are no rating constraints on these investments. While complying with the above policies, the remaining assets of the Sub-Fund may also invest in other types of bonds, in money market instruments, in deposits, and in the following up to these percentages of net assets: equities and equity-linked instruments: 10%; and UCITS/UCIs: 10%."
LU0128497293,Fund,Pictet Short-Term Money Market USD P dy Distribution,UNT,USD,EMTF,90.340,2022-12-02 17:37:00,Indicative price,0.0,90.310,2022-12-01 16:53:00,90.340,90.340,90.310,90.340,89.060,90.340,Pictet-Short-Term Money Market ,PNK,MUTUALFUND,us_market,USD,,,90.04219818115234,2022-12-06,0.04856745473268057,0.08404351064911138,35.9685648028703,-0.344319259958048,,,,,,,,
